{
    "$schema": "http://json-schema.org/draft-07/schema#",
    "type": "object",
    "required": ["id", "name", "price", "stock"],
    "properties": {
      "id": { "type": "integer" },
      "name": { "type": "string" },
      "price": { "type": "number" },
      "stock": { "type": "integer" }
    }
  }
  